numeroPedido	dataDeposito	dataPublicacao	dataConcessao	puPais	puNumero	puData	siglasIPC	descIPC	siglasCPC	descCPC	titulo	resumo	nomeDepositante	nomeInventor	nomeTitular	nomeProcurador	inicioFaseNacional	numPCT	numWO	numeroDividido
PI 0406712-6 B1	23/01/2004	20/12/2005	06/07/2021	ESTADOS UNIDOS	10/350,452	24/01/2003	['F03D 7/04;', 'F03D 9/00;', 'F03D 7/02']	['F03D 7/04 (1968.09             )Controle dos motores a vento; / motores a vento tendo o eixo de rotação substancialmente paralelo para o fluxo de ar na entrada do rotor; / Controle automático; Regulagem;', 'F03D 9/00 (1968.09             )Adaptações de motores a vento para uso especial; Combinações de motores a vento com aparelhos por eles acionados;', 'F03D 7/02 (1968.09             )Controle dos motores a vento; / motores a vento tendo o eixo de rotação substancialmente paralelo para o fluxo de ar na entrada do rotor;']	-	-	TURBINA EÓLICA CONECTADA À REDE ELÉTRICA DURANTE EVENTO DE BAIXA TENSÃO	"""GERADOR A TURBINA EÓLICA COM UM CONTROLADOR DE PASSAGEM ACOMPANHADA DE BAIXA TENSÃO E UM MÉTODO PARA O CONTROLE DOS COMPONENTES DA TURBINA EÓLICA"". É descrita uma turbina eólica. A turbina eólica inclui um sistema de controle do passo das hélices para variar o passo de uma ou mais hélices e um controlador de turbina acoplado ao sistema de controle do passo das hélices. Uma primeira fonte de energia é acoplada ao controlador de turbina e ao sistema de controle do passo das hélices para fornecer energia durante um primeiro modo de operação. As fontes de energia não passíveis de interrupção são acopladas ao controlador de turbina e ao sistema de controle do passo das hélices para fornecerem energia durante um segundo modo de operação. O controlador de turbina detecta uma transição do primeiro modo de operação para o segundo modo de operação e faz com que o sistema de controle do passo das hélices varie o passo de uma ou mais hélices em resposta à transição."	-	Wilhelm Janssen / Henning Luetze / Andreas Buecker / Till Hoffmann / Ralf Hagedorn	GENERAL ELECTRIC COMPANY (US)	ANA PAULA SANTOS CELIDONIO	25/07/2005	['US2004001774', 'W.O.']	['2004/067958', '']	"BR 12 2015 007892 0   
	 						(Data:23/01/2004);"
PI 0409750-5 A2	08/04/2004	09/05/2006	-	ORGANIZAÇÃO EUROPÉIA DE PATENTES	03008295.2	09/04/2003	['H02J 3/38;', 'F03D 9/00']	['H02J 3/38 (1968.09             )Disposições de circuitos para redes principais ou de distribuição de corrente alternada; / Disposições para alimentar em paralelo uma única rede por meio de dois ou mais geradores, conversores, ou transformadores;', 'F03D 9/00 (1968.09             )Adaptações de motores a vento para uso especial; Combinações de motores a vento com aparelhos por eles acionados;']	-	-	FAZENDA DE VENTO E MÉTODO PARA OPERAR A MESMA	"""FAZENDA DE VENTO E MÉTODO PARA OPERAR A MESMA"". É fornecida uma fazenda de vento com ao menos duas turbinas eólicas (1, 2, 3, 4) conectadas a uma grade de energia, dita fazenda de vento ainda compreendendo uma unidade de controle (5) conectada a ditas ao menos duas turbinas eólicas (1, 2, 3, 4), e uma unidade de sensor (6) conectada a dita grade de energia e a dita unidade de controle (5), sendo que dita unidade de sensor (6) está apta a medir a freqüência de grade de dita grade de energia e transmitir dita freqüência de grade transmitida à dita unidade de controle (5) , e sendo que dita unidade de controle (5) está apta a controlar a saída de potência real de dita fazenda de vento de acordo com dita freqüência de grade medida. Anda mais, é proposto um método para a operação de uma fazenda de vento, dito método compreendendo as etapas de medir a freqüência de grade através de uma unidade de sensor, transmitir dita freqüência de grade medida a uma unidade de controle centralizada, determinar se a freqüência de grade medida está fora de uma faixa predeterminada e, se a freqüência de grade medida está fora de dita faixa predeterminada, selecionar ao menos uma dentre as ao menos duas turbinas eólicas compreendidas em dita fazenda de vento através de dita unidade de controle e regular a saída de potência de dita uma menos uma turbina eólica selecionada."	General Electric Company (US)	Hans Henning Lütze / Stefan Rieken / Dietmar Meyer	-	GUSMÃO & LABRUNIE S/C LTDA	07/10/2005	['EP2004003804', 'W.O.']	['2005/067119', '']	-
PI 0403798-7 B1	02/09/2004	07/06/2005	14/03/2017	ESTADOS UNIDOS	10/655,514	03/09/2003	['F03D 9/00;', 'H02P 9/04']	['F03D 9/00 (1968.09             )Adaptações de motores a vento para uso especial; Combinações de motores a vento com aparelhos por eles acionados;', 'H02P 9/04 (1968.09             )Disposições para o controle de geradores elétricos com o propósito de obtenção de uma saída desejada; / Controle exercido sobre um motor primário não elétrico e dependendo do valor da característica elétrica de saída do gerador;']	-	-	Sistema de controle de tensão em gerador eólico	"""CONTROLE DA TENSÃO PARA GERADORES EÓLICOS"". Um sistema de controle do gerador a turbina eólica inclui uma regulagem rápida da tensão (110) próxima aos geradores individuais com uma regulagem de potência reativa total relativamente lenta em uma sub-estação ou a nível da fazenda de vento (150). O ponto de ajuste do regulador de tensão relativamente rápido é ajustado pelo regulador de potência reativa relativamente lento. A regulagem rápida da tensão pode se dar nos terminais do gerador (115) ou em um ponto remoto sintetizado (140)."	-	Einar V. Larsen	General Electric Company (US)	ANA PAULA SANTOS CELIDONIO	-	-	-	-
PI 0405546-2 B1	10/12/2004	05/09/2006	29/09/2015	-	-	-	['H01M 8/0252;', 'F03D 13/10;', 'F03D 13/40;', 'H01M 8/0247', 'H01M 8/0252;', 'F03D 13/10;', 'F03D 13/40;', 'B65D 2585/6897;', 'F05B 2240/302;', 'F05B 2260/02;', 'H01M 8/0247']	['H01M 8/0252 (2016.01             )tubular', 'F03D 13/10 (2016.01             )Montagem de motores a vento', 'F03D 13/40 (2016.01             )Instalações ou métodos especialmente adaptados para o transporte de componentes de motores a vento', 'H01M 8/0247 (2016.01             )caracterizado pela forma', 'H01M 8/0252Tubular', 'F03D 13/10Assembly of wind motors Arrangements for erecting wind motors', 'F03D 13/40Arrangements or methods specially adapted for transporting wind motor components', 'B65D 2585/6897others', 'F05B 2240/302Segmented or sectional blades', 'F05B 2260/02Transport, e.g. specific adaptations or devices for conveyance', 'H01M 8/0247Porous or non porous and characterised by the form']	['H01M 8/0252;', 'F03D 13/10;', 'F03D 13/40;', 'B65D 2585/6897;', 'F05B 2240/302;', 'F05B 2260/02;', 'H01M 8/0247']	['H01M 8/0252Tubular', 'F03D 13/10Assembly of wind motors Arrangements for erecting wind motors', 'F03D 13/40Arrangements or methods specially adapted for transporting wind motor components', 'B65D 2585/6897others', 'F05B 2240/302Segmented or sectional blades', 'F05B 2260/02Transport, e.g. specific adaptations or devices for conveyance', 'H01M 8/0247Porous or non porous and characterised by the form']	CONJUNTO DE ESTRUTURAS PARA MANUSEIO, TRANSPORTE E ARMAZENAMENTO DE PÁS PARA ROTORES DE AEROGERADORES	"""CONJUNTO DE ESTRUTURAS PARA MANUSEIO, TRANSPORTE E ARMAZENAMENTO DE PÁS PARA ROTORES DE AEROGERADORES"". Definido por, pelo menos, duas estruturas (10), cada uma composta por uma armação periférica (11) que arranja em seu interior um conjunto de braços de ancoragem (12) e cintas flexíveis (15 e 16). A acomodação e fixação das pás (P) dos rotores de aerogeradores é realizada introduzindo ambas estruturas (10) em torno de um par de pás (P) alinhadas adjacente, longitudinal e inversamente entre si. A presente invenção proporciona uma redução os custos finais de transporte das pás de aerogeradores através da compactação e associação de mais de uma pá por conjunto. Ainda, a presente invenção garante a efetiva segurança e proteção das pás transportadas pois as cintas flexíveis distribuem as cargas sobre a superfície da pá, protegendo-a de danos."	-	Bento Massahiko Koike	Tecsis Tecnologia e Sistemas Avançados S.A. (BR/SP)	Abreu, Merkl e Advogados Associados	-	-	-	-
PI 0512825-0 A2	27/06/2005	08/04/2008	-	ESTADOS UNIDOS	10/880,909	30/06/2004	['C08F 2/32;', 'C08L 91/00;', 'C08K 5/10']	['C08F 2/32 (1974.07             )Processos de polimerização; / Polimerização em emulsão água em óleo;', 'C08L 91/00 (1974.07             )Composições de óleos, gorduras ou ceras; Composições de seus derivados;', 'C08K 5/10 (1974.07             )Uso de ingredientes orgânicos; / Compostos contendo oxigênio; / Ésteres; Eter-ésteres;']	-	-	MÉTODO DE TRATAMENTO DE ÁGUA	POLÍMERO DE EMULSÃO INVERSA, E, MÉTODOS DE TRATAMENTO DE ÁGUA, E DE PRODUÇÃO DE UM POLÍMERO DE EMULSÃO INVERSA A presente invenção fornece um polímero de emulsão inversa tendo uma fase dispersa composta de uma solução aquosa de um polímero acrílico e uma fase contínua composta de um éster de um ácido graxo e um álcool solúvel em água. A presente invenção ainda inclui um método de tratamento de água que inclui adicionar o polímero de emulsão inversa a um sistema de água industrial e hidrolisar o éster de um ácido graxo e um álcool solúvel em água em um sal de ácido graxo. O polímero de emulsão inversa pode ser usado como um floculante para clarificar sistemas de água industrial em temperatura elevada e/ou pressão elevada e pH alto.	Nalco Company (US)	Michael G. Strominger / John T. Malito / Paul J. Harris	-	KASZNAR LEONARDOS PROPRIEDADE INTELECTUAL	28/12/2006	['US2005022915', 'W.O.']	['2006/004745', '']	-
C1 0405546-2 F1	08/07/2005	09/09/2008	22/03/2016	-	-	-	['F03D 11/00']	['F03D 11/00 (1968.09             )Detalhes, peças ou acessórios não incluídos nos, nem pertinentes aos outros grupos desta subclasse;']	-	-	DESENVOLVIMENTO EM CONJUNTO DE ESTRUTURAS PARA MANUSEIO, TRANSPORTE E ARMAZENAMENTO DE PÁS PARA ROTORES DE AEROGERADORES	"DESENVOLVIMENTO EM CONJUNTO DE ESTRUTURAS PARA MANUSEIO, TRANSPORTE E ARMAZENAMENTO DE PÁS PARA ROTORES DE AEROGERADORES"", de modo a garantir a integridade das pás (P), mais particularmente da ponta da dita pá (P). O presente certificado de adição da invenção compreende essencialmente duas estruturas (10), cada uma composta por uma armação periférica (11) que arranja no interior um conjunto de braços de ancoragem (12) e cintas flexíveis (15) e (16) para a acomodação e fixação de um par de pás (P) alinhadas adjacente, longitudinal e inversamente entre si; um meio para envolver as duas pás (30), tal como uma cinta, cabo, faixa ou corrente; capas protetoras (31) e elementos protetores (32), por exemplo de fibra de vidro ou outro polímero, de modo a assegurar a integridade da ponta da pá (P) e evitar o atrito direto entre as ditas pás (P)."	-	Bento Massahiko Koike	Tecsis Tecnologia e Sistemas Avançados S.A. (BR/SP)	Abreu, Merkl e Advogados Associados	-	-	-	-
PI 0503924-0 B1	26/08/2005	24/04/2007	15/09/2015	-	-	-	['B01F 7/18']	['B01F 7/18 (1968.09             )Misturadores com agitadores rotativos em receptáculos fixos; Amassadeiras; Amassadores; / com agitadores girando em torno de um eixo vertical; / com pás ou braços;']	-	-	EQUIPAMENTO MISTURADOR BASCULANTE GIRATÓRIO E PROVIDO DE AGITADORES, E, RESPECTIVO PROCESSO OPERACIONAL.	"""EQUIPAMENTO DESLIZANTE PARA FABRICAÇÃO DE COMPOSTO ORGÂNICO DOTADO DE MECANISMO MISTURADOR BASCULANTE E GIRATÓRIO PROVIDO DE PLURALIDADE DE DISPOSITIVOS AGITADORES E RESPECTIVO PROCESSO OPERACIONAL"". Mais particularmente trata de um equipamento (1) deslizante para fabricação de composto orgânico dotado de mecanismo misturador basculante e giratório provido de pluralidade de dispositivos (10) agitadores, sendo que todos os elementos envolvidos foram notadamente desenvolvidos com o intuito de proporcionar meios de mistura e agitação para a produção de adubo composto; referido equipamento (1) compreende, basicamente, uma estrutura metálica (4) deslizante sobre um quadro formado por trilhos (5), por sua vez dispostos sobre tanques contendo adubo composto, equipamento este dotado de mecanismo basculante que prevê um eixo (9) longitudinal onde é disposto pluralidade de dispositivos ou braços (10) agitadores, distribuídos em helicóide; o equipamento (10) tem performance de alta qualidade e, devido sua constituição estrutural, permite ser instalado em área espacial bem menor do que os dispositivos tradicionais, atuando sobre vários tanques durante uma mesma operação e com uma quantidade de agitadores (10) menor do que a quantidade de tanques, sendo assim, de custo reduzido frente aos convencionais, porém otimizando e sistematizando a agitação do adubo contido em cada um dos tanques."	-	Hiroki Sumiya	Hiroki Sumiya (JP)	Loyal Trade Mark Assessoria da Prop. Industrial S/C LtdaJOSÉ DAMASCENO ALBUESDENIS ALLAN DANIELJOSÉ DAMASCENO ALBUESJOSÉ DAMASCENO ALBUESJOSÉ DAMASCENO ALBUESJOSÉ DAMASCENO ALBUESJOSÉ DAMASCENO ALBUESJOSÉ DAMASCENO ALBUESJOSÉ DAMASCENO ALBUESJOSÉ DAMASCENO ALBUES	-	-	-	-
